{
  "mode": "data",
  "species": [
    {
      "id": "A",
      "label": "x",
      "points": [
        {
          "time": 0,
          "concentration": 0
        },
        {
          "time": 0,
          "concentration": 0
        }
      ]
    }
  ],
  "time_unit": "s",
  "concentration_unit": "mol/L",
  "time_range": [
    0,
    0
  ]
}
